00:00:29.037113 IP 10.2.0.6.ssh > 10.2.0.101.49834: P 430216162:430216226(64) ack 3875743936 win 4197 <nop,nop,timestamp 2 4216518380>
00:00:29.037337 IP 10.2.0.6.ssh > 10.2.0.101.49834: P 64:128(64) ack 1 win 4197 <nop,nop,timestamp 2 4216518380>
00:00:29.037574 IP 10.2.0.6.ssh > 10.2.0.101.49834: P 128:208(80) ack 1 win 4197 <nop,nop,timestamp 2 4216518380>
00:00:29.037815 IP 10.2.0.6.ssh > 10.2.0.101.49834: P 208:288(80) ack 1 win 4197 <nop,nop,timestamp 2 4216518380>
00:00:29.038063 IP 10.2.0.6.ssh > 10.2.0.101.49834: P 288:368(80) ack 1 win 4197 <nop,nop,timestamp 2 4216518380>
00:00:29.038174 IP 10.2.0.101.49834 > 10.2.0.6.ssh: . ack 208 win 291 <nop,nop,timestamp 4216518409 2>
00:00:29.038281 IP 10.2.0.6.ssh > 10.2.0.101.49834: P 368:432(64) ack 1 win 4197 <nop,nop,timestamp 2 4216518409>
00:00:29.038497 IP 10.2.0.101.49834 > 10.2.0.6.ssh: . ack 368 win 291 <nop,nop,timestamp 4216518409 2>
00:00:29.038542 IP 10.2.0.6.ssh > 10.2.0.101.49834: P 432:512(80) ack 1 win 4197 <nop,nop,timestamp 2 4216518409>
00:00:29.038765 IP 10.2.0.6.ssh > 10.2.0.101.49834: P 512:576(64) ack 1 win 4197 <nop,nop,timestamp 2 4216518409>
